{"being_ref":"dm:being:v1:VlG-k1yMoEXlpk0GvxVCALmpTlFp7GizcHzt3hPcQQs","content_hash":"2d32099cd8cdfbe5c3298e71b884cf16f257a063a162751df2dd85013aad3cd1","issued_at_ms":1800000000001,"previous_control_head":"dm:identity:v1:Nca5Hlx-dWYGgzJap1H82V4VJTwKDbGOufJ0_-8-Lys","previous_manifest_hash":"cba12f829782f5d24564ca8749a624bdb6cc2f03c4293ad04cae6e1c8b2b4331","previous_revision":1,"revocations":[{"artifact_id":"dm:identity:v1:TqjzPtnRSNUW8q3HjD6YhyGIv87AcReaX3aUkf5qqb0","body":{"being_ref":"dm:being:v1:VlG-k1yMoEXlpk0GvxVCALmpTlFp7GizcHzt3hPcQQs","control_generation":0,"control_sequence":1,"cutoff_incarnation_sequence":0,"embodiment_id":"embodiment:vector:legion","previous_control_head":"dm:identity:v1:Nca5Hlx-dWYGgzJap1H82V4VJTwKDbGOufJ0_-8-Lys","revocation_generation":1},"kind":"revocation","schema":"dm.identity.artifact/v1","signatures":[{"algorithm":"Ed25519","key_id":"dm:key:v1:r_yqlYEigkMIL_vta_WIeDk-RPW-W2_77UMO7dRoVL4","role":"root-authorization","value":"-lbsIhgkd7ohMcElJ-443dDfyfnWH9bt8BGcJ3CJ0nXCoGtJ9UrSIYhvFVNelm3sdHqAstzKK_Y2AFp8qjusBQ"},{"algorithm":"Ed25519","key_id":"dm:key:v1:zq6BNx7SnY3fYG_z8vq_F0LA-t_oqS14k-7fpd7I2FM","role":"root-authorization","value":"WnNXuLV6jXpnCQ34l0Xf3sntoF_t3c3qVyAuakF1iJp7xJZObAXaayCTyP2GvyBU39bFh-FJG3Yzm1QcWyCXBQ"}]}],"schema":"dm.we.embodiment-retirement/v1","signatures":[{"alg":"Ed25519","kid":"dm:key:v1:r_yqlYEigkMIL_vta_WIeDk-RPW-W2_77UMO7dRoVL4","value":"XfFhGSLQYsh7RmaU4GfUPanTTMmeMoLHm5ofGf5cnPAvBgNYD_soaC5LpU2kmEp7GosgSJ2glnQGuEdgeYvhBw"},{"alg":"Ed25519","kid":"dm:key:v1:zq6BNx7SnY3fYG_z8vq_F0LA-t_oqS14k-7fpd7I2FM","value":"-PWYuxJ0Din93jpC6wHsezVazAuAhomKXW5jXabRJll1jKQ31NcdL2NymE-ra6tVNN8cKB3TIvJbBZUMXzFgDA"}],"successor_control_head":"dm:identity:v1:TqjzPtnRSNUW8q3HjD6YhyGIv87AcReaX3aUkf5qqb0","successor_manifest_hash":"cb6e669dc3ec8239ce400f991ab247d46a7373245efd0240c259ba0b9a402572","successor_revision":2}
